----------------------------------------------------------------------------
CrystalDiskInfo 8.17.3 (C) 2008-2022 hiyohiyo
                                Crystal Dew World: https://crystalmark.info/
----------------------------------------------------------------------------

    OS : Windows 10 Professional [10.0 Build 19044] (x64)
  Date : 2022/12/05 22:46:20

-- Controller Map ----------------------------------------------------------
 + Standard SATA AHCI Controller [ATA]
   - Samsung SSD 850 PRO 512GB
   - WDC WD1003FZEX-00MK2A0
 - Standard SATA AHCI Controller [ATA]
 - Microsoft Storage Spaces Controller [SCSI]
 - Microsoft VHD Loopback Controller [SCSI]

-- Disk List ---------------------------------------------------------------
 (01) Samsung SSD 850 PRO 512GB : 512.1 GB [0/1/0, pd1] - sg
 (02) WDC WD1003FZEX-00MK2A0 : 1000.2 GB [1/1/0, pd1]

----------------------------------------------------------------------------
 (01) Samsung SSD 850 PRO 512GB
----------------------------------------------------------------------------
           Model : Samsung SSD 850 PRO 512GB
        Firmware : EXM02B6Q
   Serial Number : ***************
       Disk Size : 512.1 GB (8.4/137.4/512.1/512.1)
     Buffer Size : Unknown
     Queue Depth : 32
    # of Sectors : 1000215216
   Rotation Rate : ---- (SSD)
       Interface : Serial ATA
   Major Version : ACS-2
   Minor Version : ATA8-ACS version 4c
   Transfer Mode : SATA/600 | SATA/600
  Power On Hours : 43200 hours
  Power On Count : 2175 count
     Host Writes : 41067 GB
Wear Level Count : 273
     Temperature : 33 C (91 F)
   Health Status : Good (95 %)
        Features : S.M.A.R.T., NCQ, TRIM, DevSleep
       APM Level : ----
       AAM Level : ----
    Drive Letter : C:

-- S.M.A.R.T. --------------------------------------------------------------
ID Cur Wor Thr RawValues(6) Attribute Name
05 _99 _99 _10 000000000001 Reallocated Sector Count
09 _91 _91 __0 00000000A8C0 Power-on Hours
0C _97 _97 __0 00000000087F Power-on Count
B1 _95 _95 __0 000000000111 Wear Leveling Count
B3 _99 _99 _10 000000000001 Used Reserved Block Count (Total)
B5 100 100 _10 000000000000 Program Fail Count (Total)
B6 100 100 _10 000000000000 Erase Fail Count (Total)
B7 _99 _99 _10 000000000001 Runtime Bad Block (Total)
BB _99 _99 __0 000000000006 Uncorrectable Error Count
BE _67 _46 __0 000000000021 Airflow Temperature
C3 199 199 __0 000000000006 ECC Error Rate
C7 100 100 __0 000000000000 CRC Error Count
EB _99 _99 __0 00000000005E POR Recovery Count
F1 _99 _99 __0 00140D6B0580 Total LBAs Written

-- IDENTIFY_DEVICE ---------------------------------------------------------
        0    1    2    3    4    5    6    7    8    9
000: 0040 3FFF C837 0010 0000 0000 003F 0000 0000 0000
010: FFFF FFFF FFFF FFFF FFFF FFFF FFFF FFFF FFFF FFFF
020: 0000 0000 0000 4558 4D30 3242 3651 5361 6D73 756E
030: 6720 5353 4420 3835 3020 5052 4F20 3531 3247 4220
040: 2020 2020 2020 2020 2020 2020 2020 8001 4001 2F00
050: 4000 0200 0200 0007 3FFF 0010 003F FC10 00FB 0101
060: FFFF 0FFF 0000 0007 0003 0078 0078 0078 0078 0F10
070: 0000 0000 0000 0000 0000 001F 850E 00C6 016C 0060
080: 03FC 0039 746B 7D01 4163 7469 BC01 4163 407F 0001
090: 0001 0000 0001 0000 0000 0000 0000 0000 0000 0000
100: 12B0 3B9E 0000 0000 0000 0008 4000 0000 5002 5388
110: A0AF 1494 0000 0000 0000 0000 0000 0000 0000 401E
120: 401C 0000 0000 0000 0000 0000 0000 0000 0029 0000
130: 0000 0000 0000 0000 0000 0000 0000 0000 0000 0000
140: 0000 0000 0000 0000 0000 0000 0000 0000 0000 0000
150: 0000 0000 0000 0000 0000 0000 0000 0000 0000 0000
160: 0000 0000 0000 0000 0000 0000 0000 0000 0000 0001
170: 2020 2020 2020 2020 0000 0000 0000 0000 0000 0000
180: 0000 0000 0000 0000 0000 0000 0000 0000 0000 0000
190: 0000 0000 0000 0000 0000 0000 0000 0000 0000 0000
200: 0000 0000 0000 0000 0000 0000 003D 0000 0000 4000
210: 0000 0000 0000 0000 0000 0000 0000 0001 0000 0000
220: 0000 0000 107F 0000 0000 0000 0000 0000 0000 0000
230: 0000 0000 0000 0000 0000 0800 0000 0000 0000 0000
240: 0000 0000 0000 4000 0000 0000 0000 0000 0000 0000
250: 0000 0000 0000 0000 0000 C9A5

-- SMART_READ_DATA ---------------------------------------------------------
     +0 +1 +2 +3 +4 +5 +6 +7 +8 +9 +A +B +C +D +E +F
000: 01 00 05 33 00 63 63 01 00 00 00 00 00 00 09 32
010: 00 5B 5B C0 A8 00 00 00 00 00 0C 32 00 61 61 7F
020: 08 00 00 00 00 00 B1 13 00 5F 5F 11 01 00 00 00
030: 00 00 B3 13 00 63 63 01 00 00 00 00 00 00 B5 32
040: 00 64 64 00 00 00 00 00 00 00 B6 32 00 64 64 00
050: 00 00 00 00 00 00 B7 13 00 63 63 01 00 00 00 00
060: 00 00 BB 32 00 63 63 06 00 00 00 00 00 00 BE 32
070: 00 43 2E 21 00 00 00 00 00 00 C3 1A 00 C7 C7 06
080: 00 00 00 00 00 00 C7 3E 00 64 64 00 00 00 00 00
090: 00 00 EB 12 00 63 63 5E 00 00 00 00 00 00 F1 32
0A0: 00 63 63 80 05 6B 0D 14 00 00 00 00 00 00 00 00
0B0: 00 00 00 00 00 00 00 00 00 00 00 00 00 00 00 00
0C0: 00 00 00 00 00 00 00 00 00 00 00 00 00 00 00 00
0D0: 00 00 00 00 00 00 00 00 00 00 00 00 00 00 00 00
0E0: 00 00 00 00 00 00 00 00 00 00 00 00 00 00 00 00
0F0: 00 00 00 00 00 00 00 00 00 00 00 00 00 00 00 00
100: 00 00 00 00 00 00 00 00 00 00 00 00 00 00 00 00
110: 00 00 00 00 00 00 00 00 00 00 00 00 00 00 00 00
120: 00 00 00 00 00 00 00 00 00 00 00 00 00 00 00 00
130: 00 00 00 00 00 00 00 00 00 00 00 00 00 00 00 00
140: 00 00 00 00 00 00 00 00 00 00 00 00 00 00 00 00
150: 00 00 00 00 00 00 00 00 00 00 00 00 00 00 00 00
160: 00 00 00 00 00 00 00 00 00 00 00 00 00 00 00 53
170: 03 00 01 00 02 FF 00 10 01 00 00 00 00 00 00 00
180: 00 00 00 00 00 00 00 00 00 00 00 00 00 00 00 00
190: 00 00 00 00 00 00 00 00 00 00 00 00 00 00 00 00
1A0: 00 00 00 00 00 00 00 00 00 00 00 00 00 00 00 00
1B0: 00 00 00 00 00 00 00 00 00 00 00 00 00 00 00 00
1C0: 00 00 00 00 00 00 00 00 00 00 00 00 00 00 00 00
1D0: 00 00 00 00 00 00 00 00 00 00 00 00 00 00 00 00
1E0: 00 00 00 00 00 00 00 00 00 00 00 00 00 00 00 00
1F0: 00 00 00 00 00 00 00 00 00 00 00 00 00 00 00 12

-- SMART_READ_THRESHOLD ----------------------------------------------------
     +0 +1 +2 +3 +4 +5 +6 +7 +8 +9 +A +B +C +D +E +F
000: 01 00 05 0A 00 00 00 00 00 00 00 00 00 00 09 00
010: 00 00 00 00 00 00 00 00 00 00 0C 00 00 00 00 00
020: 00 00 00 00 00 00 B1 00 00 00 00 00 00 00 00 00
030: 00 00 B3 0A 00 00 00 00 00 00 00 00 00 00 B5 0A
040: 00 00 00 00 00 00 00 00 00 00 B6 0A 00 00 00 00
050: 00 00 00 00 00 00 B7 0A 00 00 00 00 00 00 00 00
060: 00 00 BB 00 00 00 00 00 00 00 00 00 00 00 BE 00
070: 00 00 00 00 00 00 00 00 00 00 C3 00 00 00 00 00
080: 00 00 00 00 00 00 C7 00 00 00 00 00 00 00 00 00
090: 00 00 EB 00 00 00 00 00 00 00 00 00 00 00 F1 00
0A0: 00 00 00 00 00 00 00 00 00 00 00 00 00 00 00 00
0B0: 00 00 00 00 00 00 00 00 00 00 00 00 00 00 00 00
0C0: 00 00 00 00 00 00 00 00 00 00 00 00 00 00 00 00
0D0: 00 00 00 00 00 00 00 00 00 00 00 00 00 00 00 00
0E0: 00 00 00 00 00 00 00 00 00 00 00 00 00 00 00 00
0F0: 00 00 00 00 00 00 00 00 00 00 00 00 00 00 00 00
100: 00 00 00 00 00 00 00 00 00 00 00 00 00 00 00 00
110: 00 00 00 00 00 00 00 00 00 00 00 00 00 00 00 00
120: 00 00 00 00 00 00 00 00 00 00 00 00 00 00 00 00
130: 00 00 00 00 00 00 00 00 00 00 00 00 00 00 00 00
140: 00 00 00 00 00 00 00 00 00 00 00 00 00 00 00 00
150: 00 00 00 00 00 00 00 00 00 00 00 00 00 00 00 00
160: 00 00 00 00 00 00 00 00 00 00 00 00 00 00 00 00
170: 00 00 00 00 00 00 00 00 00 00 00 00 00 00 00 00
180: 00 00 00 00 00 00 00 00 00 00 00 00 00 00 00 00
190: 00 00 00 00 00 00 00 00 00 00 00 00 00 00 00 00
1A0: 00 00 00 00 00 00 00 00 00 00 00 00 00 00 00 00
1B0: 00 00 00 00 00 00 00 00 00 00 00 00 00 00 00 00
1C0: 00 00 00 00 00 00 00 00 00 00 00 00 00 00 00 00
1D0: 00 00 00 00 00 00 00 00 00 00 00 00 00 00 00 00
1E0: 00 00 00 00 00 00 00 00 00 00 00 00 00 00 00 00
1F0: 00 00 00 00 00 00 00 00 00 00 00 00 00 00 00 4E

----------------------------------------------------------------------------
 (02) WDC WD1003FZEX-00MK2A0
----------------------------------------------------------------------------
           Model : WDC WD1003FZEX-00MK2A0
        Firmware : 01.01A01
   Serial Number : ***************
       Disk Size : 1000.2 GB (8.4/137.4/1000.2/1000.2)
     Buffer Size : Unknown
     Queue Depth : 32
    # of Sectors : 1953525168
   Rotation Rate : 7200 RPM
       Interface : Serial ATA
   Major Version : ACS-2
   Minor Version : ACS-3 Revision 3b
   Transfer Mode : SATA/600 | SATA/600
  Power On Hours : 31696 hours
  Power On Count : 2138 count
     Temperature : 29 C (84 F)
   Health Status : Good
        Features : S.M.A.R.T., NCQ
       APM Level : ----
       AAM Level : ----
    Drive Letter : F:

-- S.M.A.R.T. --------------------------------------------------------------
ID Cur Wor Thr RawValues(6) Attribute Name
01 200 200 _51 000000000004 Read Error Rate
03 176 170 _21 000000000876 Spin-Up Time
04 _64 _64 __0 000000008CD1 Start/Stop Count
05 200 200 140 000000000000 Reallocated Sectors Count
07 200 200 __0 000000000000 Seek Error Rate
09 _57 _57 __0 000000007BD0 Power-On Hours
0A 100 100 __0 000000000000 Spin Retry Count
0B 100 100 __0 000000000000 Recalibration Retries
0C _98 _98 __0 00000000085A Power Cycle Count
C0 200 200 __0 00000000007B Power-off Retract Count
C1 189 189 __0 000000008C59 Load/Unload Cycle Count
C2 114 _99 __0 00000000001D Temperature
C4 200 200 __0 000000000000 Reallocation Event Count
C5 200 200 __0 000000000000 Current Pending Sector Count
C6 200 200 __0 000000000000 Uncorrectable Sector Count
C7 200 200 __0 000000000000 UltraDMA CRC Error Count
C8 200 200 __0 000000000000 Write Error Rate

-- IDENTIFY_DEVICE ---------------------------------------------------------
        0    1    2    3    4    5    6    7    8    9
000: 427A 3FFF C837 0010 0000 0000 003F 0000 0000 0000
010: FFFF FFFF FFFF FFFF FFFF FFFF FFFF FFFF FFFF FFFF
020: 0000 0000 0000 3031 2E30 3141 3031 5744 4320 5744
030: 3130 3033 465A 4558 2D30 304D 4B32 4130 2020 2020
040: 2020 2020 2020 2020 2020 2020 2020 8010 4000 2F00
050: 4001 0000 0000 0007 3FFF 0010 003F FC10 00FB 0100
060: FFFF 0FFF 0000 0107 0003 0078 0078 0078 0078 0000
070: 0000 0000 0000 0000 0000 001F 970E 0006 0044 0040
080: 03FE 001F 746B 7D61 4123 7469 BC41 4123 007F 003C
090: 003C 0000 FFFE 0000 0000 0000 0000 0000 0000 0000
100: 6DB0 7470 0000 0000 0000 0000 6003 0000 5001 4EE2
110: 61C1 AA29 0000 0000 0000 0000 0000 0000 0000 4018
120: 4018 0000 0000 0000 0000 0000 0000 0000 0029 0000
130: 0000 0000 0000 0000 0000 0000 0000 0000 0000 0000
140: 0000 0000 0004 0000 0000 0000 0000 0000 0000 0000
150: 0000 0000 0000 0000 0000 0000 0000 0000 0000 0000
160: 0000 0000 0000 0000 0000 0000 0000 0000 0000 0000
170: 0000 0000 0000 0000 0000 0000 0000 0000 0000 0000
180: 0000 0000 0000 0000 0000 0000 0000 0000 0000 0000
190: 0000 0000 0000 0000 0000 0000 0000 0000 0000 0000
200: 0000 0000 0000 0000 0000 0000 3035 0000 0000 0000
210: 0000 0000 0000 0000 0000 0000 0000 1C20 0000 0000
220: 0000 0000 107E 0000 0000 0000 0000 0000 0000 0000
230: 0000 0000 0000 0000 0001 1000 0000 0000 0000 0000
240: 0000 0000 0000 0000 0000 0000 0000 0000 0000 0000
250: 0000 0000 0000 0000 0000 B0A5

-- SMART_READ_DATA ---------------------------------------------------------
     +0 +1 +2 +3 +4 +5 +6 +7 +8 +9 +A +B +C +D +E +F
000: 10 00 01 2F 00 C8 C8 04 00 00 00 00 00 00 03 27
010: 00 B0 AA 76 08 00 00 00 00 00 04 32 00 40 40 D1
020: 8C 00 00 00 00 00 05 33 00 C8 C8 00 00 00 00 00
030: 00 00 07 2E 00 C8 C8 00 00 00 00 00 00 00 09 32
040: 00 39 39 D0 7B 00 00 00 00 00 0A 32 00 64 64 00
050: 00 00 00 00 00 00 0B 32 00 64 64 00 00 00 00 00
060: 00 00 0C 32 00 62 62 5A 08 00 00 00 00 00 C0 32
070: 00 C8 C8 7B 00 00 00 00 00 00 C1 32 00 BD BD 59
080: 8C 00 00 00 00 00 C2 22 00 72 63 1D 00 00 00 00
090: 00 00 C4 32 00 C8 C8 00 00 00 00 00 00 00 C5 32
0A0: 00 C8 C8 00 00 00 00 00 00 00 C6 30 00 C8 C8 00
0B0: 00 00 00 00 00 00 C7 32 00 C8 C8 00 00 00 00 00
0C0: 00 00 C8 08 00 C8 C8 00 00 00 00 00 00 00 00 00
0D0: 00 00 00 00 00 00 00 00 00 00 00 00 00 00 00 00
0E0: 00 00 00 00 00 00 00 00 00 00 00 00 00 00 00 00
0F0: 00 00 00 00 00 00 00 00 00 00 00 00 00 00 00 00
100: 00 00 00 00 00 00 00 00 00 00 00 00 00 00 00 00
110: 00 00 00 00 00 00 00 00 00 00 00 00 00 00 00 00
120: 00 00 00 00 00 00 00 00 00 00 00 00 00 00 00 00
130: 00 00 00 00 00 00 00 00 00 00 00 00 00 00 00 00
140: 00 00 00 00 00 00 00 00 00 00 00 00 00 00 00 00
150: 00 00 00 00 00 00 00 00 00 00 00 00 00 00 00 00
160: 00 00 00 00 00 00 00 00 00 00 82 00 D4 2B 01 7B
170: 03 00 01 00 02 74 05 00 00 00 00 00 00 00 00 00
180: 00 00 01 02 00 00 00 00 00 00 00 00 00 00 00 00
190: 00 00 00 00 00 00 00 00 00 00 00 00 00 00 00 00
1A0: 00 00 00 00 00 00 00 00 00 00 00 00 00 00 00 00
1B0: 00 00 00 00 00 00 00 00 00 00 00 00 00 00 00 00
1C0: 00 00 00 00 00 00 00 00 00 00 00 00 00 00 00 00
1D0: 00 00 00 00 00 00 00 00 00 00 00 00 00 00 00 00
1E0: 00 00 00 00 00 00 00 00 00 00 00 00 00 00 00 00
1F0: 00 00 00 00 00 00 00 00 00 00 00 00 00 00 00 05

-- SMART_READ_THRESHOLD ----------------------------------------------------
     +0 +1 +2 +3 +4 +5 +6 +7 +8 +9 +A +B +C +D +E +F
000: 10 00 01 33 C8 C8 00 00 00 00 00 00 00 00 03 15
010: 00 00 00 00 00 00 00 00 00 00 04 00 00 00 00 00
020: 00 00 00 00 00 00 05 8C 00 00 00 00 00 00 00 00
030: 00 00 07 00 C8 C8 00 00 00 00 00 00 00 00 09 00
040: 00 00 00 00 00 00 00 00 00 00 0A 00 00 00 00 00
050: 00 00 00 00 00 00 0B 00 00 00 00 00 00 00 00 00
060: 00 00 0C 00 00 00 00 00 00 00 00 00 00 00 C0 00
070: 00 00 00 00 00 00 00 00 00 00 C1 00 00 00 00 00
080: 00 00 00 00 00 00 C2 00 00 00 00 00 00 00 00 00
090: 00 00 C4 00 00 00 00 00 00 00 00 00 00 00 C5 00
0A0: 00 00 00 00 00 00 00 00 00 00 C6 00 00 00 00 00
0B0: 00 00 00 00 00 00 C7 00 00 00 00 00 00 00 00 00
0C0: 00 00 C8 00 C8 C8 00 00 00 00 00 00 00 00 00 00
0D0: 00 00 00 00 00 00 00 00 00 00 00 00 00 00 00 00
0E0: 00 00 00 00 00 00 00 00 00 00 00 00 00 00 00 00
0F0: 00 00 00 00 00 00 00 00 00 00 00 00 00 00 00 00
100: 00 00 00 00 00 00 00 00 00 00 00 00 00 00 00 00
110: 00 00 00 00 00 00 00 00 00 00 00 00 00 00 00 00
120: 00 00 00 00 00 00 00 00 00 00 00 00 00 00 00 00
130: 00 00 00 00 00 00 00 00 00 00 00 00 00 00 00 00
140: 00 00 00 00 00 00 00 00 00 00 00 00 00 00 00 00
150: 00 00 00 00 00 00 00 00 00 00 00 00 00 00 00 00
160: 00 00 00 00 00 00 00 00 00 00 00 00 00 00 00 00
170: 00 00 00 00 00 00 00 00 00 00 00 00 00 00 00 00
180: 00 00 00 00 00 00 00 00 00 00 00 00 00 00 00 00
190: 00 00 00 00 00 00 00 00 00 00 00 00 00 00 00 00
1A0: 00 00 00 00 00 00 00 00 00 00 00 00 00 00 00 00
1B0: 00 00 00 00 00 00 00 00 00 00 00 00 00 00 00 00
1C0: 00 00 00 00 00 00 00 00 00 00 00 00 00 00 00 00
1D0: 00 00 00 00 00 00 00 00 00 00 00 00 00 00 00 00
1E0: 00 00 00 00 00 00 00 00 00 00 00 00 00 00 00 00
1F0: 00 00 00 00 00 00 00 00 00 00 00 00 00 00 00 0D

